{
  "record_version": "v1",
  "result_id": "search-gaia-osm-demo-road-layer-v1",
  "source": "GAIA",
  "authority_ref": "SocioProphet/gaia-world-model",
  "entity_type": "MAP_LAYER",
  "title": "GAIA OSM Demo Road Layer",
  "snippet": "OpenStreetMap-derived GAIA demo road layer preserving OSM way identity, attribution, H3 refs, and MapLibre-compatible vector tile metadata.",
  "path_or_uri": "gaia://fixtures/geospatial/osm-derived-map-tile-layer.sample.v1.json",
  "canonical_format": "gaia/map-tile-layer-manifest+json",
  "source_format": "json",
  "owner_ref": "SocioProphet",
  "project_refs": ["gaia-world-model", "sherlock-search", "sociosphere"],
  "permission_ref": "public/demo",
  "spatial_refs": [
    {"scheme": "h3", "value": "8928308280fffff", "role": "coverage"},
    {"scheme": "h3", "value": "89283082807ffff", "role": "coverage"},
    {"scheme": "osm", "value": "way/424242", "role": "source-feature"}
  ],
  "temporal_refs": [
    {"role": "source_extract_time", "value": "2026-04-26T00:00:00Z"}
  ],
  "evidence_refs": [
    "osm-binding-demo-way-424242",
    "gaia-road-segment-demo-osm-way-424242"
  ],
  "model_refs": [],
  "runtime_refs": [],
  "handling_tags": ["demo", "osm", "maplibre", "vector-tile", "advisory"],
  "provenance_refs": [
    "SocioProphet/gaia-world-model:fixtures/geospatial/osm-road-feature-binding.sample.v1.json",
    "SocioProphet/gaia-world-model:fixtures/geospatial/osm-derived-map-tile-layer.sample.v1.json"
  ],
  "score": {
    "lexical": 0.82,
    "semantic": 0.8,
    "geospatial": 0.92,
    "temporal": 0.75,
    "evidence": 0.86,
    "runtime": 0.0,
    "final": 0.82
  },
  "actions": {
    "open_local": false,
    "open_cloud": true,
    "summarize": true,
    "create_task": false,
    "draft_reply": false,
    "open_map": true,
    "show_evidence": true,
    "open_runtime": false
  }
}
